{"versiya":"1.0","agent":"D1","sana":"2026-09-19","ishlar":[{"boshlandi":"2026-09-19T06:00:02+05:00","tugadi":"2026-09-19T06:01:44+05:00","davomiylik_s":102.3,"holat":"ok","xato_soni":0,"xato_oxirgi":null,"kirdi":{"amocrm":412,"getcourse":268,"sheets":14},"chiqdi":{"lidlar":412,"talabalar":268,"paket":1},"kpi":{"paket_yaratildi":1,"manba_ok":2,"manba_eski":1}}],"kun":{"ishlar_soni":1,"ok":1,"xato":0,"davomiylik_s_jami":102.3,"kpi":{"paket_yaratildi":1}}}
